title,content
"Tên của Giáo Hoàng, “Giấy khai sanh” của giáo hoàng mới","Vatican News (06/5/2025) – Sau khi được bầu kế vị Thánh Phêrô, việc thay thế tên rửa tội bằng tên Giáo hoàng đã trở thành một truyền thống từ ngàn năm, có nguồn gốc sâu xa trong lịch sử Giáo hội, gắn liền với nguồn gốc của Kitô giáo: chính Chúa Giêsu đã đổi tên tông đồ Simon thành Phêrô, vị Giáo hoàng đầu tiên.
“Ngài muốn được gọi là gì?”
Sau khi bầu chọn được Giáo hoàng mới, có 2 câu hỏi được đặt ra trước khi tân Giáo hoàng lần đầu tiên mặc phẩm phục giáo hoàng: Acceptasne electionem de te canonice factam in Summum Pontificem? (Ngài có chấp nhận việc bầu chọn theo giáo luật làm Giáo hoàng không?) Quo nomine vis vocari? (Ngài muốn được gọi tên gì?)
Nếu cuộc bầu chọn được chấp nhận, thì đám đông tín hữu sẽ nghe Hồng y trưởng đẳng phó tế loan báo những lời này bằng tiếng Latinh vang vọng khắp thế giới: "Nuntio vobis gaudium magnum: habemus papam! Eminentissimum et reverendissimum dominum ..., qui sibi imposuit nomen...". “Tôi loan báo cho anh chị em niềm vui lớn lao: chúng ta có Đức Giáo hoàng! Vị đáng kính và cao quý nhất... người đã chọn tên...” Những lời này thường được loan báo từ ban công trung tâm của Đền thờ Thánh Phêrô. Tên của tân Giáo hoàng vẫn là từ đầu tiên được khắc ghi trong tâm trí không chỉ của các Kitô hữu.
Những cái tên được sử dụng nhiều nhất và những cái tên chưa bao giờ được chọn
Truyền thống đổi tên sau khi được bầu lên ngôi Giáo hoàng đã trở thành một phong tục trong nhiều thế kỷ. Nó liên quan đến nguồn gốc lịch sử của Giáo hội. Phêrô là tên của Giáo hoàng đầu tiên. “Con là Phêrô, nghĩa là Đá, trên đá này, Thầy sẽ xây Hội Thánh của Thầy”, Chúa Giêsu đã nói với tông đồ Simon như thế.
Tên rửa tội được thay thế bằng tên Giáo hoàng, gần như để làm nổi bật “sự tái sinh” mà giám mục Roma được kêu gọi thực hiện sau khi được bầu. Trong số những cái tên được các Giáo hoàng sử dụng nhiều nhất sau khi được bầu là Pio, Gregorio, Gioan, Benedetto, Innocente, Leo và Clemente. Trong danh sách tên của các Giáo hoàng chưa có các tên như Giuse, Giacôbê, Anrê và Luca. Và cho đến nay, chưa có Giáo hoàng nào chọn tên là Phêrô như tên vị Giáo hoàng đầu tiên.
Tên của các Thánh và các Tông đồ
Trong nhiều trường hợp, tên của giáo hoàng được liên kết với tên của các vị Thánh, các tông đồ. Ví dụ, Đức Phaolô VI đã chia sẻ sự lựa chọn tên này như đã nói trong bài giảng vào ngày 30/6/1963: “Phaolô là vị Tông đồ rất yêu mến Chúa Kitô, người vô cùng mong muốn và nỗ lực để mang Tin Mừng của Chúa Kitô đến với mọi người, người đã hiến dâng cuộc đời mình vì tình yêu của Chúa Kitô”.
Triều đại Giáo hoàng là một chuỗi, một chuỗi các tên gọi. Đức Giáo hoàng Joseph Ratzinger đã nói trong buổi tiếp kiến chung ngày 27/4/2005: “Tôi muốn tự gọi mình là Benedetto XVI để kết nối tôi một cách lý tưởng với Đức Giáo hoàng đáng kính Benedetto XV, người đã lãnh đạo Giáo hội trong giai đoạn khó khăn do Chiến tranh thế giới thứ nhất... Cái tên Benedetto cũng gợi lên hình ảnh phi thường của ‘Giáo phụ vĩ đại của đời sống đan tu phương Tây’, Thánh Benedetto xứ Norcia”.
Đức Giáo hoàng Bergoglio đã chọn một cái tên chưa từng được một trong những người tiền nhiệm của ngài chọn. Trong buổi tiếp kiến với đại diện của các phương tiện truyền thông vào ngày 16/3/2013, Đức cố Giáo hoàng Phanxicô đã giải thích sự lựa chọn của riêng mình bằng những lời sau: “Cái tên đã đến trong tâm hồn tôi: Thánh Phanxicô thành Assisi. Với tôi, ngài là con người của sự nghèo khó, của hòa bình, người yêu thương và bảo vệ thụ tạo”.
Tên kép Đức Gioan Phaolô I là vị Giáo hoàng đầu tiên trong lịch sử 2.000 năm của Giáo hội chọn một tên kép. Ngài tuyên bố tại buổi đọc kinh Truyền tin ngày 27/8/1978: “Tôi không có được sự thông tuệ của Đức Giáo hoàng Gioan, cũng không có sự chuẩn bị và văn hóa của Đức Giáo hoàng Phaolô, nhưng tôi ở vị trí của các ngài, tôi phải cố gắng phục vụ Giáo hội”.
Một số Giáo hoàng đã chọn tên của người tiền nhiệm. Ví dụ, Đức Gioan Phaolô II đã chọn tên của vị tiền nhiệm. Ngài giải thích tại buổi tiếp kiến chung ngày 22/8/1979: “Giáo hoàng mới đã chọn hai tên: Gioan-Phaolô. Tôi nhớ rất rõ khoảnh khắc đó, khi tại Nhà nguyện Sistine, ngài bày tỏ ý muốn của mình: Tôi muốn mang tên Gioan và Phaolô. Quyết định này có sức thuyết phục hùng hồn. Riêng tôi, đó có vẻ là một quyết định đầy sức lôi cuốn”.

Nguồn: vaticannews.va/vi"

"Thông báo: Tuần Thường huấn Linh mục Giáo phận Mỹ Tho 2025","TÒA GIÁM MỤC MỸ THO

32 Hùng Vương, Phường 7, TP. Mỹ Tho, Tiền Giang

---o0o----

 

Mỹ Tho, ngày 13/05/2025

 

THÔNG BÁO

VỀ TUẦN THƯỜNG HUẤN LINH MỤC NĂM 2025

 

 

Kính gởi: Quý cha Hạt Trưởng,
và tất cả quý cha Giáo phận Mỹ Tho.

 

Xin thông báo đến quý cha Tuần Thường huấn Linh mục năm 2025 như sau:

- Thời gian: Từ thứ Hai 09.06 đến thứ Sáu 13.06.2025.

- Địa điểm: Trung tâm Mục vụ, 23 Lý Thường Kiệt, P. 6, TP. Mỹ Tho, Tiền Giang.

- Quý cha có mặt lúc 16g00 chiều thứ Hai ngày 09.06.2025.

- Xin quý cha mang theo laptop trong Tuần Thường huấn này.

 

 

      Lm. Tổng Đại diện

     Phaolô Trần Kỳ Minh

          (Đã ấn ký)


"

"SỨ ĐIỆP GỬI QUÝ PHẬT TỬ NHÂN DỊP ĐẠI LỄ VESAK 2025: PHẬT TỬ VÀ KITÔ HỮU TRONG CUỘC ĐỐI THOẠI GIẢI THOÁT CHO THỜI ĐẠI CHÚNG TA","WHĐ (13/5/2025) – Nhân dịp Đại lễ Vesak 2025 – Phật lịch 2569, Bộ Đối thoại Liên tôn gửi đến quý Phật tử sứ điệp với chủ đề: “Phật tử và Kitô hữu trong cuộc đối thoại giải thoát cho thời đại chúng ta”. Sau đây là toàn văn bản dịch Việt ngữ của Sứ điệp do Văn phòng Đối thoại Đại kết và Liên tôn trực thuộc Hội đồng Giám mục Việt Nam thực hiện.



BỘ ĐỐI THOẠI LIÊN TÔN


SỨ ĐIỆP GỞI QUÝ PHẬT TỬ NHÂN ĐẠI LỄ VESAK 2025


Phật tử và Kitô hữu
trong cuộc đối thoại giải thoát cho thời đại chúng ta


Các bạn Phật tử thân mến,

Như hằng năm, chúng tôi xin gửi đến quý vị lời chào thân ái và lời chúc nồng nhiệt nhất nhân dịp mừng đại lễ Vesak. Đại Lễ thiêng liêng này, tưởng niệm việc đản sinh, sự giác ngộ và nhập diệt của Đức Phật, mang ý nghĩa tâm linh sâu sắc đối với quý vị. Năm nay, lời chúc của chúng tôi được phong phú thêm bởi tinh thần Năm Thánh, đối với các tín hữu Công giáo chúng tôi, là một thời gian ân sủng, hòa giải và canh tân tâm linh.

Là những người bạn đồng hành trên con đường đối thoại, chúng tôi cũng chào mừng quý vị trong tinh thần của Nostra Aetate, bản tuyên ngôn đổi mới của Công đồng Vatican II về mối liên hệ của Giáo hội với các tôn giáo ngoài Kitô giáo, năm nay tròn sáu mươi năm được công bố. Từ năm 1965 đến nay, Nostra Aetate đã làm sâu sắc thêm sự gắn kết của chúng tôi đối với những tín đồ thuộc các truyền thống tôn giáo khác. Được truyền cảm hứng từ tầm nhìn đó, một lần nữa chúng tôi khẳng định rằng:

“Giáo Hội Công giáo không hề phủ nhận những gì là chân thật và thánh thiện nơi các tôn giáo ấy. Với lòng kính trọng chân thành, Giáo Hội xét thấy những phương thức hành động và lối sống, những huấn giới và giáo thuyết của các tôn giáo, dù có nhiều điểm khác với chủ trương và đề nghị của Giáo Hội, nhưng vẫn thường mang lại một tia sáng của chính chân lý đang chiếu soi tất cả mọi người.” (Nostra Aetate, 2).

Dấn thân của chúng tôi nhằm đối thoại còn được củng cố qua sự nhìn nhận tích cực đối với truyền thống của quý vị, vì “Phật giáo, với nhiều tông phái khác nhau, đã nhận ra sự bất túc tận căn của thế giới vô thường này và chỉ dạy cho những kẻ thành tâm và tin tưởng con đường tìm thấy sự giải thoát trọn vẹn hay đạt đến sự giác ngộ tối thượng, nhờ những cố gắng của bản thân hoặc sự trợ lực từ trên cao" (Nostra Aetate, 2). Đối với quý vị, con đường Phật giáo đến giải thoát đòi hỏi phải vượt thắng vô minh, ái dục và khổ đau, thông qua trí tuệ, hành xử đạo đức và kỷ luật tinh thần. Cuộc hành trình đến Niết Bàn - sự tự do tối hậu khỏi vòng luân hồi sinh tử - làm nổi bật sức mạnh chuyển hóa của trí tuệ và từ bi.

Khát vọng về sự giải thoát đích thực đó vang vọng sâu sắc trong cuộc tìm kiếm chung của chúng ta về chân lý và cuộc sống viên mãn, tương ứng với giáo huấn của mỗi truyền thống. Đức Phật đã dạy:

“Ái lìa, không chấp thủ. Cú pháp khéo biện tài. Thấu suốt từ vô ngại, Hiểu thứ lớp trước sau. Thân này thân cuối cùng Vị như vậy được gọi, Bậc Ðại trí, đại nhân.” (Kinh Pháp Cú, chương 24, kệ 352). Đối với Đức Giêsu, Chân lý có sức giải thoát: “Các ngươi sẽ biết sự thật, và sự thật sẽ giải thoát các ngươi” (Gioan 8, 32).

Trong thời đại của chúng ta, vốn bị chia rẽ, xung đột và đau khổ, chúng ta nhận ra nhu cầu cấp thiết của một cuộc đối thoại giải thoát - không chỉ bằng ngôn từ, mà còn diễn dịch lời nói thành hành động cụ thể nhằm phục vụ hòa bình, công lý và phẩm giá cho mọi người.

Cũng như khi Nostra Aetate được công bố, thế giới hôm nay vẫn đang oằn mình dưới bất công, xung đột và sự bất định về tương lai. Tuy nhiên, chúng tôi vẫn tin tưởng vào khả năng sâu xa của các tôn giáo trong việc cung ứng các giải đáp ý nghĩa về “những bí nhiệm tiềm ẩn trong thân phận con người” (Nostra Aetate, 1). Cuộc đối thoại giữa chúng ta giúp chia sẻ kho tàng của các truyền thống tôn giáo, và tận dụng nguồn khôn ngoan của các truyền thống ấy để ứng phó với các thách đố cấp bách hiện nay.

Khát vọng về tình huynh đệ và đối thoại chân thành, được diễn tả cách hùng hồn trong Nostra Aetate, thúc giục chúng ta phấn đấu cho sự hiệp nhất và tình yêu giữa mọi dân tộc và quốc gia. Khát vọng đó mời gọi chúng ta nhấn mạnh đến những điểm chung, trân trọng sự khác biệt và làm phong phú lẫn nhau từ các truyền thống khác nhau.

Tinh thần này càng được đào sâu khi chúng ta cố gắng vun đắp một nền văn hóa đối thoại như con đường phía trước, với “sự cộng tác chung làm lối sống, sự hiểu biết lẫn nhau làm phương pháp và tiêu chuẩn hành động” (Tài liệu về Tình huynh đệ nhân loại vì hòa bình thế giới và cuộc sống chung, Abu Dhabi, 4/2/2019).

Với những suy tư chiêm nguyện này, chúng tôi thành tâm tin tưởng rằng: Qua đối thoại, các truyền thống tôn giáo của chúng ta có thể cống hiến những giải đáp cao đẹp cho các thách đố của thời đại.

Chúng tôi xin kính chúc quý vị một đại lễ Vesak thánh thiện và tràn đầy hoa trái!

Từ Vatican, ngày 12 tháng 5 năm 2025

Hồng y George Jacob Koovakad
Bộ trưởng

Đức ông Indunil Janakaratne Kodithuwakku Kankanamalage
Thư ký

Chuyển ngữ: Văn phòng Đối thoại Đại kết và Liên tôn
trực thuộc Hội đồng Giám mục Việt Nam

Chuyển ngữ từ: press.vatican.va"

"Đức Thánh Cha Lêô XIV duy trì tài khoản Giáo hoàng trên X và Instagram","Các trang mạng xã hội chính thức của Giáo hoàng đã được tái kích hoạt. Trên X, tài khoản là @Pontifex trong khi trên Instagram là @Pontifex – Pope Leo XIV.
Vatican News

Tài khoản X

Đức Thánh Cha Lêô XIV cũng tích cực tham gia các mạng xã hội và có ý định tiếp tục con đường mà những vị tiền nhiệm đã thực hiện. Vào ngày 12/12/2012, Đức Giáo Hoàng Biển Đức XVI đã ra mắt tài khoản @Pontifex trên Twitter, và vài tháng sau đó, tài khoản này đã được Đức Giáo Hoàng Phanxicô kế thừa. Sau đó, tài khoản Instagram chính thức mang tên @Franciscus đã được thêm vào ngày 19/3/2016. 

Các bài đăng được công bố bằng 9 ngôn ngữ, có 52 triệu người theo dõi và được viết bằng tiếng Anh, Tây Ban Nha, Bồ Đào Nha, Ý, Pháp, Đức, Ba Lan, Ả Rập và La Tinh. Nội dung được Đức Giáo Hoàng Phanxicô công bố trong nhiều năm qua sẽ sớm được lưu trữ trong một mục đặc biệt trên trang web của Tòa Thánh vatican.va.

Tài khoản Instagram

Đối với Instagram, tài khoản này có tên là @Pontifex – Pope Leo XIV, là trang cá nhân chính thức duy nhất của Đức Giáo hoàng Lêô XIV, tiếp nối tài khoản @Franciscus của Đức Giáo Hoàng Phanxicô, nội dung tài khoản này vẫn có thể truy cập được như một kho lưu trữ “Ad Memoriam”.

Đức Giáo Hoàng Phanxicô, hơn 50 ngàn bài đăng

Đức Giáo Hoàng Phanxicô có sự hiện diện ý nghĩa trên mạng xã hội: khoảng 50.000 bài đăng, trên 9 tài khoản @Pontifex (theo 9 ngôn ngữ) và trên @Franciscus. Hầu như ngày nào cũng có thể tìm thấy những thông điệp truyền giáo ngắn hoặc lời kêu gọi ủng hộ hòa bình, công lý xã hội, chăm sóc thụ tạo, đạt được sự tương tác lớn, đặc biệt là trong những giai đoạn quan trọng nhất. Ví dụ, vào năm 2020, trong thời đại dịch, các sứ điệp của ngài đã được xem 27 tỷ lần.


Nguồn: Vatican News"

"Đức Tân Giáo hoàng Lêô: Sự phong phú về học thuật và mục vụ","Đức Tân Giáo hoàng Lêô

Sự phong phú về học thuật và mục vụ


Cách đây không lâu, trong khi truyền thông liên tục đưa tin sự kỳ vọng về một vị tân giáo hoàng người châu Á, châu Phi hoặc vị Hồng y có kinh nghiệm làm việc lâu năm tại Giáo triều Rôma, thì đêm 08 tháng 5 vừa qua, cả thế giới đầy bất ngờ khi được Giáo triều công bố kết quả bầu chọn từ Mật nghị Hồng y về Đức Giáo hoàng Lêô XIV, người ít được giới tuyền thông đề cập đến.
Trong lần bầu chọn này, Chúa Thánh Thần đã mang đến cho nhân loại một kết quả đầy bất ngờ. Việc Chúa thực hiện lắm khi vượt xa tầm suy đoán từ lý trí con  người.
Thế nhưng, khi đọc lại tiểu sử của Đức Giáo hoàng Lêô, nhiều người không khỏi bất ngờ trước sự phong phú về khả năng học thuật và kinh nghiệm mục vụ của Đức Thánh Cha.
Đức Thánh Cha chào đời tại thành phố Chicago, nước Mỹ, trong một gia đình đa văn hoá. Mẹ ngài là người Tây Ban Nha. Cha ngài có gốc Pháp và Ý.  Từ thời thơ ấu, ngài đã mở lòng ra với những ngôn ngữ và nền văn hoá khác. Sự hiểu biết và phạm vi mục vụ của ngài không bị đóng khung trong nước Mỹ, mà từ năm 1985, ngài đã được sai đi thi hành sứ vụ tại Pêru (thuộc châu Mỹ La tinh) và làm việc tại đây tổng cộng khoảng 22 năm, trước khi được bổ nhiệm vào vai trò Tổng trưởng Bộ Giám mục năm 2023.
Ngoài tiếng Anh là tiếng mẹ đẻ, Đức Thánh Cha còn thông thạo tiếng Tây Ban Nha, tiếng Pháp, tiếng Bồ Đào Nha và tiếng Ý. Sự thành thạo về những ngôn ngữ này là lợi thế to lớn khi Đức Thánh Cha làm việc tại Giáo triều Rôma, giao tiếp với các giám mục và đông đảo Dân Chúa trên toàn cầu.
Không chỉ được đào tạo về triết học và thần học, trước khi chịu chức linh mục, Đức Thánh Cha còn hoàn thành chương trình cử nhân toán học. Ngài đã hoàn tất chương trình thạc sĩ thần học, thạc sĩ và tiến sĩ Giáo luật. Ngài từng là giáo sư môn Giáo luật, Giáo phụ và Thần học Luân lý tại đại chủng viện ở Pêru. Trong vai trò phó chủ tịch Hội đồng Giám mục Pêru, chủ tịch Uỷ ban Văn hoá và Giáo dục, chắc chắn Đức Thánh Cha đã tiếp xúc và làm việc trong môi trường học thuật với trình độ chuyên môn cao.
Ngoài khả năng học thuật, ngài còn là nhà đào tạo gương mẫu trong vai trò Giám đốc tu viện thánh Augustinô, Hoa Kỳ. Hiểu biết và kinh nghiệm của nhà đào tạo, trải nghiệm đời sống cộng đoàn của một tu sĩ dòng Augustinô sẽ giúp ích rất nhiều cho Đức Thánh Cha khi củng cố và phát triển đời sống thánh hiến trong Giáo hội.
Ngoài ra, trong vai trò cha sở giáo xứ và giám quản giáo phận, Đức Thánh Cha đã tiếp xúc trực tiếp và thể hiện lòng thương xót đối với người nghèo, những người bị gạt ra bên lề xã hội. Lối suy tư của ngài đã thấm nhuần đời sống thực tế của Dân Chúa, nhất là đời sống của người nghèo.
Trong vai trò chủ tịch Uỷ ban Văn hoá và Giáo dục và phó chủ tịch Hội đồng Giám mục Pêru, hai nhiệm kỳ làm Bề trên Tổng quyền dòng Augustinô và Tổng trưởng Bộ Giám mục tại Giáo triều Rôma, chắc chắn Đức Thánh Cha đã hiểu biết và có kinh nghiệm giải quyết những vấn nạn của Giáo hội địa phương và Giáo hội toàn cầu. Ngài đã sớm tiếp xúc với những vấn đề mang tầm quốc tế trước khi trở thành Giáo hoàng.
Với bề dày kinh nghiệm về học thuật và mục vụ, những quyết định của Đức Thánh Cha sẽ có nền tảng thần học và Giáo luật, nhưng cũng không quá xa rời đời sống thực tế của người Công giáo và những vấn nạn của thời đại
Thiết nghĩ thời điểm hiện tại vẫn còn quá sớm khi bàn về tư tưởng và đường hướng mục vụ của Đức Thánh Cha cho Giáo hội toàn cầu. Trong đức tin, chúng ta tin rằng Chúa Thánh Thần, Đấng đã mang đến sự bất ngờ cho Giáo hội và thế giới trong lần bầu chọn giáo hoàng, sẽ còn mang đến làn gió mới đầy bất ngờ dưới thời Đức Giáo hoàng Lêô.
Như lời ngỏ của Đức Tân Giáo hoàng trong khoảnh khắc ra mắt Dân Chúa lần đầu tiên, Giáo hội Công giáo tiến về tương lai cùng với Đức Thánh Cha, nhưng không cậy dựa vào khả năng của lý trí và ý chí, mà đặt nền tảng trên sự gặp gỡ và hiệp nhất với Đức Kitô, trong niềm hy vọng vào ơn soi dẫn của Chúa Thánh Thần.

Phan Định"
