title,content
"TGM Mỹ Tho: Thông báo Phong chức Phó tế 2025","TÒA GIÁM MỤC MỸ THO
32 Hùng Vương, P.7,
TP. Mỹ Tho, Tiền Giang
Mỹ Tho, ngày 02 tháng 05 năm 2025
THÔNG BÁO PHONG CHỨC PHÓ TẾ
Kính gửi: Quý cha, quý tu sĩ nam nữ
và anh chị em giáo dân.
Ngày 05.06.2025 tới đây, Đức Giám mục Giáo phận dự định sẽ phong chức phó tế cho 7 thầy đại chủng sinh có tên sau đây:
1. Thầy Ignatiô Võ Quốc Công, sinh năm 1989, thuộc Giáo xứ Rạch Thiên, Long An;
2. Thầy Phêrô Nguyễn Văn Cường, sinh năm 1989, thuộc Giáo xứ Fatima, Đồng Tháp;
3. Thầy Giuse Võ Khắc Nhất, sinh năm 1990, thuộc Giáo xứ Kiến Bình, Long An;
4. Thầy Phêrô Trần Thế Anh Tài, sinh năm 1989, thuộc Giáo xứ Cao Lãnh, Đồng Tháp;
5. Thầy Đôminicô Nguyễn Anh Thư, sinh năm 1991, thuộc Giáo xứ Chợ Bưng, Tiền Giang;
6. Thầy Giuse Huỳnh Khánh Thừa, sinh năm 1989, thuộc Giáo xứ Nha Ràm, Long An;
7. Thầy Đôminicô Saviô Đỗ Hoàng Vũ, sinh năm 1993, thuộc Giáo xứ Long Định 1, Tiền Giang;
Xin quý cha đọc thông báo này cho quý tu sĩ và anh chị em giáo dân vào ba ngày Chúa nhật, 11/5, 18/5 và 25/5/2025, để Dân Chúa hiệp lời cầu nguyện cho quý thầy dọn lòng sốt sắng lãnh nhận chức phó tế.
Nếu có điều gì ngăn trở theo Giáo Luật, xin quý cha và anh chị em báo cho Tòa giám mục biết. Anh chị em giáo dân có thể báo qua cha sở hoặc trực tiếp với chúng tôi tại Tòa giám mục.
Kính chúc quý cha, quý tu sĩ nam nữ và toàn thể anh chị em giáo dân tràn đầy Hồng Ân Thiên Chúa.
Lm. Phaolô Trần Kỳ Minh
Tổng Đại diện
(Đã ấn ký)"
